молча́ние,silence,Иногда молчание лучше слов.,Sometimes silence is better than words.
распоряжа́ться,to manage / dispose of,Он не может распоряжаться своим временем.,He can't manage his own time.
кле́тка,cage / cell,Птица сидит в клетке.,The bird sits in a cage.
пораже́ны в права́х,disenfranchised (deprived of rights),Мужчины абсолютно поражены в правах.,Men are completely disenfranchised.
вред,harm / damage,Курение наносит вред здоровью.,Smoking causes harm to health.
о́стрые углы́,sharp edges / corners,Острые углы в его речи пропали.,The sharp edges in his speech disappeared.
на пти́чьих права́х,on precarious terms (no legal rights),Без гражданства ты на птичьих правах.,Without citizenship you're on precarious terms.
